client_id	path	sentence_id	sentence	sentence_domain	up_votes	down_votes	age	gender	accents	variant	locale	segment	sentence_norm	duration[ms]
810a5947e4756703437249c28dd6c942fa15ab994d402d1bedbac34213f3575cffcee0e218c989d9cf616797af2d47628cedbf27ee9446dcc43912b097b58d9e	common_voice_xmf_42073954.wav	cbdcdfa3911d60d9ab47ffd8096e26086bf3fbd40559c0ab11cb78e80da89366	ბრელი იბდი დო გიშებლი უბირული არდგილიშა, კოჩი ვახორანდჷნ ეფერ არდგილიშა.		4	0	twenties	female_feminine	ზუგიდური, ზუგიდური		xmf		ბრელი იბდი დო გიშებლი უბირული არდგილიშა კოჩი ვახორანდჷნ ეფერ არდგილიშა	9000
810a5947e4756703437249c28dd6c942fa15ab994d402d1bedbac34213f3575cffcee0e218c989d9cf616797af2d47628cedbf27ee9446dcc43912b097b58d9e	common_voice_xmf_42074398.wav	7a20de50a3aaa27a33f98a205e46c062465110b1eb73410e6a39177f746d8aaa	ჟირი ჯიმა მახინჯი კოჩი ქოჸოფე დო გილეშეს ოხირუშა.		4	2	twenties	female_feminine	ზუგიდური, ზუგიდური		xmf		ჟირი ჯიმა მახინჯი კოჩი ქოჸოფე დო გილეშეს ოხირუშა	7056
810a5947e4756703437249c28dd6c942fa15ab994d402d1bedbac34213f3575cffcee0e218c989d9cf616797af2d47628cedbf27ee9446dcc43912b097b58d9e	common_voice_xmf_42074399.wav	b7a05070be83a2e2db2c0db94f7d61049aeb18b0ae5bcab1905edc8da4848367	ქიმერთ ხოლოშავო, ა, მუში დელმახორეშ ოსური.		4	0	twenties	female_feminine	ზუგიდური, ზუგიდური		xmf		ქიმერთ ხოლოშავო ა მუში დელმახორეშ ოსური	5868
810a5947e4756703437249c28dd6c942fa15ab994d402d1bedbac34213f3575cffcee0e218c989d9cf616797af2d47628cedbf27ee9446dcc43912b097b58d9e	common_voice_xmf_42074400.wav	d89e07b46f35f2489702a9404721798b620ae5ef789011c773d3cc788a661e66	უჩაში სქუალენქ თე ზოჯუა მუმაში ვაშისრულეს, ხვალე ართი უკულაში სქუაქ წაუკითხჷ დავითნი.		4	0	twenties	female_feminine	ზუგიდური, ზუგიდური		xmf		უჩაში სქუალენქ თე ზოჯუა მუმაში ვაშისრულეს ხვალე ართი უკულაში სქუაქ წაუკითხჷ დავითნი	9756
810a5947e4756703437249c28dd6c942fa15ab994d402d1bedbac34213f3575cffcee0e218c989d9cf616797af2d47628cedbf27ee9446dcc43912b097b58d9e	common_voice_xmf_42074406.wav	25763ff77fabef429016a8387246ec0230121efa07e8ad1f4fbf6ec5d2e17dce	სუმი ქომოლ სქუაქ გეურჩქინდუ თე ხენწიფეში სქუას თე ცირაწკჷმა.		4	2	twenties	female_feminine	ზუგიდური, ზუგიდური		xmf		სუმი ქომოლ სქუაქ გეურჩქინდუ თე ხენწიფეში სქუას თე ცირაწკჷმა	6336
810a5947e4756703437249c28dd6c942fa15ab994d402d1bedbac34213f3575cffcee0e218c989d9cf616797af2d47628cedbf27ee9446dcc43912b097b58d9e	common_voice_xmf_42074407.wav	0397fa886800adc28605e97b56d26dd7857a9c97b6a4b593ce34afb0c57e5cd2	ათე დღაქ მუმადუნ ირ კოჩი ქარწყეთ დო თქვა გიჩქუნა, მუს მემეხვარებუთინ.		4	0	twenties	female_feminine	ზუგიდური, ზუგიდური		xmf		ათე დღაქ მუმადუნ ირ კოჩი ქარწყეთ დო თქვა გიჩქუნა მუს მემეხვარებუთინ	7560
810a5947e4756703437249c28dd6c942fa15ab994d402d1bedbac34213f3575cffcee0e218c989d9cf616797af2d47628cedbf27ee9446dcc43912b097b58d9e	common_voice_xmf_42435678.wav	05f96d699b3846d82be174fb834ad9dade12508400ab05dbc28e9a9ff2d916a8	მირექ სი ჰა ?	general	4	0	twenties	female_feminine	ზუგიდური, ზუგიდური		xmf		მირექ სი ჰა	3780
810a5947e4756703437249c28dd6c942fa15ab994d402d1bedbac34213f3575cffcee0e218c989d9cf616797af2d47628cedbf27ee9446dcc43912b097b58d9e	common_voice_xmf_42435728.wav	8b777e85f1ce31cbb96d86515d52ffcc4a9895802d07e71ef226a6df956db9a0	წინგის ოკოდუნ თექ გეგნოფაჩუნდჷ დო ქუას ქუმნოდვანდჷ.		4	0	twenties	female_feminine	ზუგიდური, ზუგიდური		xmf		წინგის ოკოდუნ თექ გეგნოფაჩუნდჷ დო ქუას ქუმნოდვანდჷ	9396
810a5947e4756703437249c28dd6c942fa15ab994d402d1bedbac34213f3575cffcee0e218c989d9cf616797af2d47628cedbf27ee9446dcc43912b097b58d9e	common_voice_xmf_42435747.wav	78d312ad40c943723ac7dec1eba5d86c7e14e8b77d1425a5f1e708fde4f8ef0b	მუჟამსით ეკონიას დოწყარჷ პეული დო დუდშა მუნუფორაფუდუკონ ოკონ თეშ, თოლშა ჩილამურეფქ ქოუცუ.		4	0	twenties	female_feminine	ზუგიდური, ზუგიდური		xmf		მუჟამსით ეკონიას დოწყარჷ პეული დო დუდშა მუნუფორაფუდუკონ ოკონ თეშ თოლშა ჩილამურეფქ ქოუცუ	13788
810a5947e4756703437249c28dd6c942fa15ab994d402d1bedbac34213f3575cffcee0e218c989d9cf616797af2d47628cedbf27ee9446dcc43912b097b58d9e	common_voice_xmf_42435756.wav	d401e8bee0c47b459955a779e8a574ccc5cf67ef910285f315100e87bb6c459e	თაქ მითა მიწონებჷ თინერი, რინაშ დათებუს ხამუშა ანტინენ.		4	0	twenties	female_feminine	ზუგიდური, ზუგიდური		xmf		თაქ მითა მიწონებჷ თინერი რინაშ დათებუს ხამუშა ანტინენ	7848
810a5947e4756703437249c28dd6c942fa15ab994d402d1bedbac34213f3575cffcee0e218c989d9cf616797af2d47628cedbf27ee9446dcc43912b097b58d9e	common_voice_xmf_42435765.wav	8e3ef37b82a71071131b36abc7a62c9d7dea0e3baaf98caa313a3a875076fe11	ჩქიმ დუნაჩინა გეგნოჩით დო დუზუკულით მით თქვან უკულ მოურსინ თინეფს.		4	0	twenties	female_feminine	ზუგიდური, ზუგიდური		xmf		ჩქიმ დუნაჩინა გეგნოჩით დო დუზუკულით მით თქვან უკულ მოურსინ თინეფს	8568
810a5947e4756703437249c28dd6c942fa15ab994d402d1bedbac34213f3575cffcee0e218c989d9cf616797af2d47628cedbf27ee9446dcc43912b097b58d9e	common_voice_xmf_42435799.wav	1f1cf52d108700d753ab9666d5f4304e625c7b5a32b535d890141c6cb8257394	ქოძირეს, ზღვას ჭითა უშქური ქჷმუღუნი.		4	0	twenties	female_feminine	ზუგიდური, ზუგიდური		xmf		ქოძირეს ზღვას ჭითა უშქური ქჷმუღუნი	6588
810a5947e4756703437249c28dd6c942fa15ab994d402d1bedbac34213f3575cffcee0e218c989d9cf616797af2d47628cedbf27ee9446dcc43912b097b58d9e	common_voice_xmf_42435806.wav	1f76af889aba32044dcefa19671ec20676ff4ba2cf6fe03e8aac4032daeb4ccc	ვარა თელა დო ვარა ღურავა		4	0	twenties	female_feminine	ზუგიდური, ზუგიდური		xmf		ვარა თელა დო ვარა ღურავა	4536
810a5947e4756703437249c28dd6c942fa15ab994d402d1bedbac34213f3575cffcee0e218c989d9cf616797af2d47628cedbf27ee9446dcc43912b097b58d9e	common_voice_xmf_42435810.wav	f2b11133ae3438044ea4e1bf35f7cb03f8397eb0360261229684870afce2edc4	ფოფორი ახალ ნაღაჭა ჸოფუდჷ დო ჸვას რასი ჭითა ლენტა გუნოკირუედჷ.		4	0	twenties	female_feminine	ზუგიდური, ზუგიდური		xmf		ფოფორი ახალ ნაღაჭა ჸოფუდჷ დო ჸვას რასი ჭითა ლენტა გუნოკირუედჷ	9216
8c6be9a0de9a57c10648982a848aca86ddcc9659e1b0839e5e24e3c0f13e3d321a284e2b7a83a047dc1d05f97d950d0c277e2d2513b23b677801e2e442cd096b	common_voice_xmf_42344068.wav	277527eb0792e944a75d9d39b561c4bed3cd168691990d2a2998d4b7ace0781a	ბაღუშ კუნთხუს,ჭე ეპუხურია აკანს, ლარტყას მუკოკვენწელერი კოჭოფიშ სინთეშ თუდო ნაცალაშ ხვისტაშა ქიგეუხუნუდჷ.		2	0		male			xmf		ბაღუშ კუნთხუს ჭე ეპუხურია აკანს ლარტყას მუკოკვენწელერი კოჭოფიშ სინთეშ თუდო ნაცალაშ ხვისტაშა ქიგეუხუნუდჷ	12888
8c6be9a0de9a57c10648982a848aca86ddcc9659e1b0839e5e24e3c0f13e3d321a284e2b7a83a047dc1d05f97d950d0c277e2d2513b23b677801e2e442cd096b	common_voice_xmf_42690600.wav	d0553a31693455086bf00c6cf5960378c003efbf928173e2dd1ceb90c177b180	მიდგაქ რდუნ ქიდირაგადუ, თენა ხაშილ ქერიშ შური რენია.		2	0		male			xmf		მიდგაქ რდუნ ქიდირაგადუ თენა ხაშილ ქერიშ შური რენია	5976
8c6be9a0de9a57c10648982a848aca86ddcc9659e1b0839e5e24e3c0f13e3d321a284e2b7a83a047dc1d05f97d950d0c277e2d2513b23b677801e2e442cd096b	common_voice_xmf_42690622.wav	4b9f7ddceed8c6b1bb9e739a4a1223b9860710d3b544abd66b6dbdbbc830955b	პეული კირიბიქ მიდიარდა, თიშო ცას ნამ ქიმკობუნ, არძა მურიცხი ქინოშქირტუ.		2	0		male			xmf		პეული კირიბიქ მიდიარდა თიშო ცას ნამ ქიმკობუნ არძა მურიცხი ქინოშქირტუ	8136
8c6be9a0de9a57c10648982a848aca86ddcc9659e1b0839e5e24e3c0f13e3d321a284e2b7a83a047dc1d05f97d950d0c277e2d2513b23b677801e2e442cd096b	common_voice_xmf_42690634.wav	54377d0fc33377394d3e282bdad2cc3ddc8259aadcc1c353f1d5c6e9bc365abb	დრო რე ანწი, ათეზჷმა კათა ბაბღუთ დო დუბაღუთ ჩქი დო მიპონათია.		2	0		male			xmf		დრო რე ანწი ათეზჷმა კათა ბაბღუთ დო დუბაღუთ ჩქი დო მიპონათია	6048
8c6be9a0de9a57c10648982a848aca86ddcc9659e1b0839e5e24e3c0f13e3d321a284e2b7a83a047dc1d05f97d950d0c277e2d2513b23b677801e2e442cd096b	common_voice_xmf_42690635.wav	99ffa1b039c56f84d09893205e3b4e7d271dc825d4706b6d30b9e12f0f09c93f	დიხაქ რკინაცალო გისქანჩჷ დო ჸვანეფშა ვეშერინედჷ.		2	0		male			xmf		დიხაქ რკინაცალო გისქანჩჷ დო ჸვანეფშა ვეშერინედჷ	5760
8c6be9a0de9a57c10648982a848aca86ddcc9659e1b0839e5e24e3c0f13e3d321a284e2b7a83a047dc1d05f97d950d0c277e2d2513b23b677801e2e442cd096b	common_voice_xmf_42690646.wav	33e5462b6ea78cf4c8a2748648ff9b6aae92a88cda4d40897214bd20599b6679	მუჭო მუკორთჷ დრო დო ხანქჷნ თეში, უარესო მეურს თე კოჩიში საქმე.		2	0		male			xmf		მუჭო მუკორთჷ დრო დო ხანქჷნ თეში უარესო მეურს თე კოჩიში საქმე	6228
8c6be9a0de9a57c10648982a848aca86ddcc9659e1b0839e5e24e3c0f13e3d321a284e2b7a83a047dc1d05f97d950d0c277e2d2513b23b677801e2e442cd096b	common_voice_xmf_42690647.wav	ae6159b2552f08464ffc6e07fd78e4bbc7b9935dc3ffc032f248a938eb51fdd7	ასე ჯოღორეფქ თოლშა მითა წიმირინუანდუნფერი ქოქიმინეს.		2	0		male			xmf		ასე ჯოღორეფქ თოლშა მითა წიმირინუანდუნფერი ქოქიმინეს	5940
8c6be9a0de9a57c10648982a848aca86ddcc9659e1b0839e5e24e3c0f13e3d321a284e2b7a83a047dc1d05f97d950d0c277e2d2513b23b677801e2e442cd096b	common_voice_xmf_42690663.wav	a2e1c215e23b6a3eab5b8d625d11c96295ed9810c6a3a18980160dc988bbed1d	მარა ჩქინოთ, მიდგას მარჩქილენა თე რინაშ კიონტინ, არძა ართიე ციფრეფი.		2	0		male			xmf		მარა ჩქინოთ მიდგას მარჩქილენა თე რინაშ კიონტინ არძა ართიე ციფრეფი	7236
8c6be9a0de9a57c10648982a848aca86ddcc9659e1b0839e5e24e3c0f13e3d321a284e2b7a83a047dc1d05f97d950d0c277e2d2513b23b677801e2e442cd096b	common_voice_xmf_42690685.wav	0c1e5a41edc9965da266362a5628a609acdfd68e97aa3833d235babdbb8c953b	ჩქი, ორინჯეფქ ართო ოკო აკიბზგუმონჭათ, ართო გებდირთათ ოკო ლიმას.		2	0		male			xmf		ჩქი ორინჯეფქ ართო ოკო აკიბზგუმონჭათ ართო გებდირთათ ოკო ლიმას	7056
8c6be9a0de9a57c10648982a848aca86ddcc9659e1b0839e5e24e3c0f13e3d321a284e2b7a83a047dc1d05f97d950d0c277e2d2513b23b677801e2e442cd096b	common_voice_xmf_42690733.wav	88d160be568fefddc7bbe05f60ac93be2399f24ed96437f98e0ad11d87ed38c2	სქან დუს ვაუღალატა, ცქვაფაქ ვადგოშუმუასი.		2	0		male			xmf		სქან დუს ვაუღალატა ცქვაფაქ ვადგოშუმუასი	5436
8c6be9a0de9a57c10648982a848aca86ddcc9659e1b0839e5e24e3c0f13e3d321a284e2b7a83a047dc1d05f97d950d0c277e2d2513b23b677801e2e442cd096b	common_voice_xmf_42690767.wav	1599ea6c0587886a97e9d1abffb5de82139d52d6636da71ce45b85333a735d5e	ირ ოჭუმარეს ომუშებუშა გვიანო მიშჷ დო უკული ქეგთმარულუავა-დო იმორდებუანდჷ.		2	0		male			xmf		ირ ოჭუმარეს ომუშებუშა გვიანო მიშჷ დო უკული ქეგთმარულუავა დო იმორდებუანდჷ	7056
8c6be9a0de9a57c10648982a848aca86ddcc9659e1b0839e5e24e3c0f13e3d321a284e2b7a83a047dc1d05f97d950d0c277e2d2513b23b677801e2e442cd096b	common_voice_xmf_42690774.wav	5ba791d6081008f45b5134f544865eb0d68f4ccdba3b295ab710ad0379c1ded8	ათაქ ნერქ დაწყორჷ.		2	0		male			xmf		ათაქ ნერქ დაწყორჷ	3528
8c6be9a0de9a57c10648982a848aca86ddcc9659e1b0839e5e24e3c0f13e3d321a284e2b7a83a047dc1d05f97d950d0c277e2d2513b23b677801e2e442cd096b	common_voice_xmf_42690787.wav	3d2e207b2aa736ae31ed9da5a37c26e97ead017aa1523aa0231ed9761817a5ec	თი სოროს ცირათ გინირთუნი თიმწკჷმა ნამუგანიშე აჸუ სხაპილქჷნ, ირო თეშინეშე მოხვადჷმინულაქ უკულ ხოლო.		2	0		male			xmf		თი სოროს ცირათ გინირთუნი თიმწკჷმა ნამუგანიშე აჸუ სხაპილქჷნ ირო თეშინეშე მოხვადჷმინულაქ უკულ ხოლო	11016
8c6be9a0de9a57c10648982a848aca86ddcc9659e1b0839e5e24e3c0f13e3d321a284e2b7a83a047dc1d05f97d950d0c277e2d2513b23b677801e2e442cd096b	common_voice_xmf_42690789.wav	f982d3f5b3ee633675b8afe3f03a970ef354e36cb0337b499aaf5d43ce48d359	მა ვამიჩქჷ რია მუჟამს მოხვადუნ, ართ მარაშავო დო ვარ ოში წანაშ უკული.		2	0		male			xmf		მა ვამიჩქჷ რია მუჟამს მოხვადუნ ართ მარაშავო დო ვარ ოში წანაშ უკული	7380
8c6be9a0de9a57c10648982a848aca86ddcc9659e1b0839e5e24e3c0f13e3d321a284e2b7a83a047dc1d05f97d950d0c277e2d2513b23b677801e2e442cd096b	common_voice_xmf_42690804.wav	2cc890dce14cc3bc69bee92670e4e4f2f7ae8a6ac823d2d35d17648cb34e5eb3	ის შხვა მუთუნ ვაუთქუალჷ დო უნელო ქანგარინჷ.		2	0		male			xmf		ის შხვა მუთუნ ვაუთქუალჷ დო უნელო ქანგარინჷ	4500
8c6be9a0de9a57c10648982a848aca86ddcc9659e1b0839e5e24e3c0f13e3d321a284e2b7a83a047dc1d05f97d950d0c277e2d2513b23b677801e2e442cd096b	common_voice_xmf_42690827.wav	dd76d5ca9098d7b24c8f3007d29d3b29c7e1847b5d86f2bbeb7cbde79f55e5de	სოდგარენ ვითოხუთ წუნთიშა გემკორჩქინდჷ, აჩქიჩქარაფილ დო აჭიროთაფილ მეჯინათ.		2	0		male			xmf		სოდგარენ ვითოხუთ წუნთიშა გემკორჩქინდჷ აჩქიჩქარაფილ დო აჭიროთაფილ მეჯინათ	7416
8c6be9a0de9a57c10648982a848aca86ddcc9659e1b0839e5e24e3c0f13e3d321a284e2b7a83a047dc1d05f97d950d0c277e2d2513b23b677801e2e442cd096b	common_voice_xmf_42690839.wav	59338640e08b2c116cdb4fd4be2bde6dd2d9c9cf77639b12164e2128dede262c	თინეფს უჩქუდეს, ნამდა რინა მონკა რდჷ დო ოჭიროთაია		2	0		male			xmf		თინეფს უჩქუდეს ნამდა რინა მონკა რდჷ დო ოჭიროთაია	5328
8c6be9a0de9a57c10648982a848aca86ddcc9659e1b0839e5e24e3c0f13e3d321a284e2b7a83a047dc1d05f97d950d0c277e2d2513b23b677801e2e442cd096b	common_voice_xmf_42690850.wav	819756fe9bde6666a1e9df58eb012a3c142a04833129f55ac40929aebbaa320b	ართი რაგადანდჷ, დუდქ ვა მათხილეს-და, გეპჭოფუნანია ურაგადუო.		2	0		male			xmf		ართი რაგადანდჷ დუდქ ვა მათხილეს და გეპჭოფუნანია ურაგადუო	5688
8c6be9a0de9a57c10648982a848aca86ddcc9659e1b0839e5e24e3c0f13e3d321a284e2b7a83a047dc1d05f97d950d0c277e2d2513b23b677801e2e442cd096b	common_voice_xmf_42690858.wav	1c27c61a2187bf0cf04e31046059a5056229247d3771dc6d97fa7e74774b3a2d	ეშობას ჯაშ მორუეფი მალა-მალას მეუღუდეს.		2	0		male			xmf		ეშობას ჯაშ მორუეფი მალა მალას მეუღუდეს	5148
8c6be9a0de9a57c10648982a848aca86ddcc9659e1b0839e5e24e3c0f13e3d321a284e2b7a83a047dc1d05f97d950d0c277e2d2513b23b677801e2e442cd096b	common_voice_xmf_42690863.wav	b4858bef300bf45f6962ac57b2738a0f714215072279a482094a805229738575	ულაშ წოხოლე გვარიან ნარღი ქახოლუდჷ, მარა იშენ გეშაჸოთ ახალენაფალა ბაობაბიშ ჩხვინჩხვეფი.		2	0		male			xmf		ულაშ წოხოლე გვარიან ნარღი ქახოლუდჷ მარა იშენ გეშაჸოთ ახალენაფალა ბაობაბიშ ჩხვინჩხვეფი	8748
8c6be9a0de9a57c10648982a848aca86ddcc9659e1b0839e5e24e3c0f13e3d321a284e2b7a83a047dc1d05f97d950d0c277e2d2513b23b677801e2e442cd096b	common_voice_xmf_42690882.wav	9571cf254ffcac99a95ad358a1114d2b1fcd93749ead8e50c7b29c70d032f5ae	ჰამო სიტყვეფი, ჩხე ჩილამური, სქან მის ვანატრუ მუში ღურა დღაშო?!		2	0		male			xmf		ჰამო სიტყვეფი ჩხე ჩილამური სქან მის ვანატრუ მუში ღურა დღაშო	6876
8c6be9a0de9a57c10648982a848aca86ddcc9659e1b0839e5e24e3c0f13e3d321a284e2b7a83a047dc1d05f97d950d0c277e2d2513b23b677801e2e442cd096b	common_voice_xmf_42690923.wav	5178a84c61a1f134762cb2097d82a34dec0cbcd029ba11432cbbfc736990c3be	ჭიი-ჭიეთ ფერმაშ განიშე დაჭყეს ქულაფი დო ხვეხვინით ულა.		2	0		male			xmf		ჭიი ჭიეთ ფერმაშ განიშე დაჭყეს ქულაფი დო ხვეხვინით ულა	6048
8c6be9a0de9a57c10648982a848aca86ddcc9659e1b0839e5e24e3c0f13e3d321a284e2b7a83a047dc1d05f97d950d0c277e2d2513b23b677801e2e442cd096b	common_voice_xmf_42690937.wav	6d1dd5d51f975555f89f920a0e2e6011ff458e039d77034f824d259286e5d4d4	ათე ჩქომქ გოფურუნი, წყარიშე გეშასხაპუ დო სქირჷს ქიგიანთხჷ.		2	0		male			xmf		ათე ჩქომქ გოფურუნი წყარიშე გეშასხაპუ დო სქირჷს ქიგიანთხჷ	6300
8c6be9a0de9a57c10648982a848aca86ddcc9659e1b0839e5e24e3c0f13e3d321a284e2b7a83a047dc1d05f97d950d0c277e2d2513b23b677801e2e442cd096b	common_voice_xmf_42690942.wav	295f0e465494253980228c7a4fe0d1dc0b5129f0af501ae19af3ccee119e5201	ასე თეშა რდჷ გერსხილ ჩქიმ ღურა დო ჩქიმ რინა.		2	0		male			xmf		ასე თეშა რდჷ გერსხილ ჩქიმ ღურა დო ჩქიმ რინა	5940
8c6be9a0de9a57c10648982a848aca86ddcc9659e1b0839e5e24e3c0f13e3d321a284e2b7a83a047dc1d05f97d950d0c277e2d2513b23b677801e2e442cd096b	common_voice_xmf_42690945.wav	940b5d10d648de523939f3fb664abb44f2b9d0a3c5814fe8b3bb74891609dfc7	მა თეშ ვორექ გორგილაფირი, სერიშ სირგილე გვალო მორგჷ.		2	0		male			xmf		მა თეშ ვორექ გორგილაფირი სერიშ სირგილე გვალო მორგჷ	5976
8c6be9a0de9a57c10648982a848aca86ddcc9659e1b0839e5e24e3c0f13e3d321a284e2b7a83a047dc1d05f97d950d0c277e2d2513b23b677801e2e442cd096b	common_voice_xmf_42690947.wav	26760b73a358763e4444f88549eaab7ad107887d7dfb37eacef5268a20ab3ba0	გალე მაზარალ ლალუაქ გორჩქინდჷ.		2	0		male			xmf		გალე მაზარალ ლალუაქ გორჩქინდჷ	3636
8c6be9a0de9a57c10648982a848aca86ddcc9659e1b0839e5e24e3c0f13e3d321a284e2b7a83a047dc1d05f97d950d0c277e2d2513b23b677801e2e442cd096b	common_voice_xmf_42690948.wav	1800cd96201e60a4c672d1090933131e7775260b2ebcb91cacc756323f4af260	არძოშა მიაჩე თიჯგურა გემუან დო ყაზაყური რინა, მუდგაჯგურა ჩქი შუროთ ვეგმაძირენანი.		2	0		male			xmf		არძოშა მიაჩე თიჯგურა გემუან დო ყაზაყური რინა მუდგაჯგურა ჩქი შუროთ ვეგმაძირენანი	7416
8c6be9a0de9a57c10648982a848aca86ddcc9659e1b0839e5e24e3c0f13e3d321a284e2b7a83a047dc1d05f97d950d0c277e2d2513b23b677801e2e442cd096b	common_voice_xmf_42690972.wav	80d3bf5a7a135fa2d33440e849939212d154a24fd9f21e08110843596e7289f4	ასტრონომს ნაციონალურ ბარგი მუკაქუნდუნ თიშენ მითინქ ვადოუჯერჷ.		2	0		male			xmf		ასტრონომს ნაციონალურ ბარგი მუკაქუნდუნ თიშენ მითინქ ვადოუჯერჷ	6336
8c6be9a0de9a57c10648982a848aca86ddcc9659e1b0839e5e24e3c0f13e3d321a284e2b7a83a047dc1d05f97d950d0c277e2d2513b23b677801e2e442cd096b	common_voice_xmf_42691041.wav	7c49adb80c9f922020b36a09a6bc2ed97b077c211aa629c25549cb0e277d5826	პირველო აშიიდჷ ჩოლამა გურაფაშო დო კითხირიშო.		2	0		male			xmf		პირველო აშიიდჷ ჩოლამა გურაფაშო დო კითხირიშო	4716
8c6be9a0de9a57c10648982a848aca86ddcc9659e1b0839e5e24e3c0f13e3d321a284e2b7a83a047dc1d05f97d950d0c277e2d2513b23b677801e2e442cd096b	common_voice_xmf_42691052.wav	2bce21062f02b98d95e38a29152c9e74b8e82f238437a262e8c1cadecdc316ed	ეჸურე-აჸურე გილეძგვაბალუდჷ კუდელიშ ციკინით.		2	0		male			xmf		ეჸურე აჸურე გილეძგვაბალუდჷ კუდელიშ ციკინით	4788
